{"id":"CND-910008","schemaVersion":"0.1.0","recordVersion":"0.1.0","revision":0,"status":"Deprecated","createdAt":"2026-09-24T10:00:00Z","createdBy":"example-author","updatedAt":"2026-09-24T10:00:00Z","updatedBy":"example-author","sourceLinks":[],"changeSummary":"Fictional validation fixture.","name":"Example Condition Type Theta","allowedValueForms":["textValue"],"replacedBy":"CND-910009"}
